{
  "author": {
    "en": "SagaAI",
    "ru": "SagaAI",
    "zh-CN": "SagaAI"
  },
  "description": {
    "en": "Builds university lecture decks (PPTX) from a JSON spec: speaker notes on every slide, editable Office Math formulas, syntax-highlighted code, academic slide types, APA 7 citations and automated QA with an optional PDF handout.",
    "ru": "Собирает университетские лекционные презентации (PPTX) из JSON-описания: заметки докладчика на каждом слайде, редактируемые формулы Office Math, подсветка кода, академические типы слайдов, ссылки APA 7 и автоматическая проверка качества с опциональным PDF-раздаточным материалом.",
    "zh-CN": "根据 JSON 规范生成大学讲座演示文稿（PPTX）：每页演讲备注、可编辑 Office Math 公式、代码高亮、学术版式、APA 7 引用与自动质量检查，可选 PDF 讲义。"
  },
  "files": {
    "CHANGELOG.md": "ac43e2e409ab1329151740e477511777e61aafa71983a52e7aa2630bdbcdbeb4",
    "SKILL.md": "cb29474a73ea477b963cb46577a10cf50685528587d95546918f6902eb87406b",
    "build_lecture.py": "a1cae70baae420e5d60698f5d27a6b62eb7c46f966af5f627d811d9ee27fa6fe",
    "compatibility.json": "07cc90e89273e37dea9bacd7f24d99e379574bd3966b46ef01ccb76bcb266659",
    "docs/limitations.md": "3e15f00db4bffefac7bed5712342478d94a434aaf157cb36e94be81f187c80e1",
    "examples/demo_lecture.json": "8105e7a7db7959466316bc7787b4bf9e4aa5c1e09bf912dd569392d05bb6af9b",
    "examples/demo_pipeline.png": "45e4cee9100cda323a5ab1370ed5273eb6f8146ca8fc07b35e0625239ce80bfb",
    "examples/demo_plot.png": "e9dfffc1861875644ddc6928351a5a33682aac94e0dac90a393c1692a20b39b5",
    "examples/lecture_assets/formula_01.png": "208e8235a7bced7c5fc627af0cae2010b655110a6da066138ec021a0c1c6b415",
    "examples/lecture_assets/formula_02.png": "58dbafeb000220bca5e34af56affc92b47194f30cee718bc15d8d7f6598c3f65",
    "examples/lecture_assets/formula_03.png": "b895dd2002e4cd55c9f4f7640acd535c3cb0df086533f617502e7dfb02a86c82",
    "examples/lecture_assets/formula_04.png": "d5a8b93b3b2e356eea79eb9f62a8df371bdc81595e5a3856bfe0e0e7aa736619",
    "lecture/__init__.py": "da7dad2316bd320871be86c96192c1bb643070e11c7f68a4ca77b01faaf721a3",
    "lecture/apa.py": "8759946b5935d6584147f8f298991965ba6978b7d5128953eb0731e8110d037c",
    "lecture/baseline.py": "0702910914ab4c97f7b5181a00a8cc523cc2a007d5d0955ec10f685adb86a48a",
    "lecture/deck.py": "c93435a8254d278a2568a07945f3b23fd64199a742989aec0429a943e0256170",
    "lecture/drift.py": "433b8b1ea8c8e2b20f7c00f48ba3b278f63ac5b55c48c9095e236c8816bd02d4",
    "lecture/figkit.py": "c5bd8d16622fd87a4c30e51d2b0ede747e4a64da595a8f48b50927a0cbe4acdb",
    "lecture/fingerprint.py": "877a36ab6a5bfa441795b8f8221959c55fbffcd4d5b100e0790b05213d8b4e8a",
    "lecture/imgqa.py": "81c941dd80fc1e3c137579e674505984ca08598be8f15325f677808ef06f6b8f",
    "lecture/layout_advisor.py": "f61cb2846b2df3dfb00d0755ff8765329c31800d683518283ed240fc86c55a59",
    "lecture/omml.py": "82bada9f46450a04053e5950b7d1b02599bcdc7114a89ee44417d21d5302fafd",
    "lecture/render.py": "ba89e04479a82cfd8d88673b2d61693728c6ae67107005918c0891afd62ab159",
    "lecture/slides.py": "03decbf0b07c637e5add38cb2387eda2440e5039d620d80f687fcb328ad87f90",
    "lecture/spec.py": "5943010b5181f584e8f02e48c63f9c1495bff53d3006e3994dc8f7340a9cf8a5",
    "lecture/stages.py": "d8b3cbe947d706a8620a09f9011334810eb3c619479cc74b47febb5f0f3216b4",
    "lecture/textfit.py": "a920122aaf5bfc375cff622e6a3186dbcd12be316270b7aa15fb59b06ae9c91b",
    "lecture/themes.py": "956a43ad3e8ab29b54055d57fde23ec38431dca2ecc4b9ea5e66a32953094e8c",
    "preflight.py": "943a0975d417e8f91bb9cde008d4ac1d88037081afc464164e9775ff47af5740",
    "qa_check.py": "50b6bf2fd2774511a7a0eee7ebc605353ca59d24435d33486fc196b1bd6c7023",
    "render_preview.py": "5e8a238a7b33a9eb418dd4cef65f5cd85a8954f9d55f2bd721fbd5a166d597c4",
    "tests/conftest.py": "7dcdef8b1b2d445f8dfcbeb19c97038d42dcb52691d245c0016f69805db37cf7",
    "tests/scenarios/test_apa_scenarios.py": "0d459a5af4d6205d5e4dd1762767ec4f0fd480d25dfaf28021eb74a530f3c446",
    "tests/scenarios/test_drift_scenarios.py": "b02d12d58d50a2ed2543e3ecd303c9ac071b7e67ff677c1ba33e79326633dbe6",
    "tests/scenarios/test_layout_scenarios.py": "293a4094e3c8cbeabf856c2750e2c5df53a5c2fc039e464ba79f17d3b670feab",
    "tests/scenarios/test_lecture_scenarios.py": "3f52006be64c5a179ee41a04db6cd91f4ccc01a00086e0020b22eb9fc434c262",
    "tests/test_apa.py": "6d3f249859204c064fed22dc43b3e2518a772144a70029490ec46ed3a088a420",
    "tests/test_baseline.py": "959a59f9c489084af276228bc94942f7a4797a7995239e3f51c4afe68ad93102",
    "tests/test_build_lecture.py": "34df214550813390bb529151babb22916c9725367bb1e64bd335b550d6a3388f",
    "tests/test_build_lecture_drift.py": "3891ce44a6712edca3a6cedcb8f6fede0ae935338935ebb4339f036b934cb08a",
    "tests/test_charts.py": "b1fec8ac45042d7e1bbd8b02a98af232e1c4166e5626a089291e57df891a8017",
    "tests/test_deck.py": "10c7000fa9b8592ef2fabb88bb285b244cebbf584975847e165e05e4affa91c2",
    "tests/test_delivery_gate.py": "c5dda4591331d2ac5a3e97397494ec7219cbcef2e43e493897628d4b6a1bf110",
    "tests/test_density.py": "2efc3310c07b915c7ae3bf8afd458e23d70dd6ebd991071d637331651afa35a1",
    "tests/test_drift.py": "923016410f78f5213dcf21b8f80681b68ca372630c23ca4b4aba7ddc2a72aa38",
    "tests/test_figkit.py": "bd60029ea7fb70d3708cffee8bc4b66c46821401a84196ef2beb6182b06add07",
    "tests/test_font_metrics.py": "bae70428e30d830d8769139c75f84074bb4752130f9f735355bab4237bd4df13",
    "tests/test_glyphs.py": "958ef9193e223d034a07b0f81d2b8c56ec1b8dc4e0af4444b2c0aa7d6ce1f173",
    "tests/test_guarantees.py": "fbcfb5eb571a17bb981428354b63a50e58b691eaf9f1f5899794857aa3d7f8e7",
    "tests/test_hyperlinks.py": "b4250cabffa81b299926270494b90e4d2eff7cdfc3429b02a0090607c75e98a7",
    "tests/test_imgqa.py": "d24844b54429f4eed186d1a6b058e37d6273166d5611e4aae9de2ae9a7109aa4",
    "tests/test_layout_advisor.py": "dfff3b638668f73abb8dffe156c41f79092949686ba51eb41f54292642cbb536",
    "tests/test_layout_fill.py": "2e5f955127fc67f9e0d5a2e3bae3d0ad71b6530ec5e4aee27c64cdd06e848c1e",
    "tests/test_omml.py": "acc335fc4deb4532f49e5e3f9867aaaf13e1b08f8df4849c7a9f023ae29e5e6f",
    "tests/test_preflight.py": "1aea4aa92a5ca4d1192d5a7e8010e8fe809411c96fbabd19bca53c4cda5b64dc",
    "tests/test_qa_check.py": "f344ac738c0b4c477084f2a0245fc6e853ca67a4b5874bbc14e2f21dd82c28a5",
    "tests/test_qa_content.py": "1247352c6f5246e0ad7e28447579d7e0412ac9a5ea841bb5b8f9b421c9d1da44",
    "tests/test_qa_duration.py": "17338572c9d8ecc078746307fe30a924f7f4eae8f590645caeb45a007ba9ad72",
    "tests/test_render.py": "dc71bd313c82fa34bb7d486249a3279ad14fe75fc944fe493301e907f825bc3b",
    "tests/test_render_preview.py": "e7f9338e2a7d387d5dbe2ae3c5fe02357e275f328c26478d1772c6dcb4b5b817",
    "tests/test_report_binding.py": "87a7f35a6cb56620302b2ae8856fa9df360ad0fd6b5c01359ce89f61f4f76566",
    "tests/test_skill_docs.py": "cd0025677c1439164151a75895ba2b4bbda4c2f8a5958a0f5c6dba1b3dedbcde",
    "tests/test_slides_b1.py": "b2ed118e78273808d2756891250e51fb88e3cd94dfa563a6068ecdffd691d33f",
    "tests/test_slots.py": "f060196282eaa0e3b8d093cae3eb246044cf9293c8342eb99fac8df7f49e0911",
    "tests/test_sources.py": "1f1f13ffbf7200950947432efa73185404cca2379b1f3bd358bccc83fa6bb300",
    "tests/test_spec.py": "80dfd114d3b350f5fa6bf8e7a9e3eefdd348d944c5182497afed13ef77073d64",
    "tests/test_stages.py": "6f5d97fc42292d2ba9e775a17251b24138a0c5f50b2def2f3e11a415169f8f4c",
    "tests/test_textfit.py": "d32f8b9c251f7953f6ddcb12a8ab55244331c852a289e24f5c6572110fa242df",
    "tests/test_typography.py": "ddedeb13ec70a2213152e6961adea2c65a6f388b690ef4e4e795a3cea2e2de33",
    "tests/test_visual_types.py": "d467207d8c26a8944be5aaccc6ed7b4543cd3cc73a5243eb506eccec3a09afaf",
    "tests/test_void.py": "8ea99ee72abc628ec34ed3919a0fbd26bdc9768c678b8123b85912741cbb41c0"
  },
  "icon": "🎓",
  "id": "lecture_slides",
  "license": {
    "acceptance_required": false,
    "spdx": "PolyForm-Noncommercial-1.0.0"
  },
  "name": {
    "en": "Lecture Slides",
    "ru": "Слайды лекций",
    "zh-CN": "讲座幻灯片"
  },
  "package": {
    "sha256": "ce6265190c66863e67bf322ee3b144650b41aec2838e6b1482505eede934ba9a",
    "size": 366920,
    "url": "skills/lecture_slides/1.8.0/package.tar.gz"
  },
  "permissions": {
    "executes_code": true
  },
  "platform": {
    "max": null,
    "min": "2.18.0"
  },
  "requires_tools": [],
  "schema": "sagaai.marketplace.entity/1",
  "source_url": "https://github.com/TVD2100/sagaai-marketplace",
  "tags": [
    "lecture",
    "slides",
    "pptx",
    "teaching",
    "formulas",
    "code"
  ],
  "type": "skill",
  "version": "1.8.0"
}
